{
  "agent": "deepseek",
  "base_sha": "1fa0032280cc3a53b5520107050f0ef6a804440a",
  "blockers": [
    "No GitHub Issue/PR evidence: API 404 and gh unavailable",
    "Local Python lacks rdkit and shap; model/SHAP rerun impossible here"
  ],
  "completed": [
    "Read remediation checklist and the repository's docs tree; recorded scope and five blocker categories"
  ],
  "evidence": [
    "docs/整改清单-修订版-2026-10-24.md"
  ],
  "generated_at": "2026-10-24T15:47:00+00:00",
  "kind": "agent_handoff",
  "remaining": [
    "Execute steps 0-4 of the remediation checklist",
    "Rerun notebooks in the locked environment and verify 46 PDFs"
  ],
  "run_id": "run-2026-10-24-01",
  "schema_version": "1.1",
  "status": "reported_unverified",
  "task": "pro3-release-2026-10-24",
  "vcs": "git"
}
